{
  "source_id": "src_20260414_ab12cd34",
  "schema_version": 1,
  "created_at": "2026-04-14T10:30:00Z",
  "source_type": "mixed",
  "origin": {
    "channel": "web_app",
    "captured_from": "manual_upload",
    "imported_by": "studio"
  },
  "title": "Toss payment UX observation",
  "description": "A short note with one supporting screenshot.",
  "sha256": "0123456789abcdef0123456789abcdef0123456789abcdef0123456789abcdef",
  "raw_root": "00_Raw/2026/04/14/source_src_20260414_ab12cd34",
  "text_path": "00_Raw/2026/04/14/source_src_20260414_ab12cd34/source.md",
  "attachments": [
    {
      "attachment_id": "att_ab12cd34",
      "path": "00_Raw/2026/04/14/source_src_20260414_ab12cd34/attachments/payment-screen.jpg",
      "mime_type": "image/jpeg",
      "sha256": "abcdef0123456789abcdef0123456789abcdef0123456789abcdef0123456789",
      "size_bytes": 284122
    }
  ],
  "tags": [
    "ux",
    "payments",
    "onboarding"
  ],
  "status": "captured"
}
